[
  {
    "field_id": "BT-1",
    "field_name": "број фактуре",
    "field_description": "Invoice number",
    "note_on_use": "Број фактуре мора бити јединствен у\nоквиру једног ПИБ-а, осим за кориснике\nјавних средстава за које мора бити\nјединствен у оквиру ЈБКЈС",
    "data_type": "Identifier",
    "cardinality": "1..1",
    "invoice_path": "/Invoice/cbc:ID",
    "credit_note_path": "/CreditNote/cbc:ID",
    "report_path": "Invoice: /Invoice/cbc:ID\nCreditNote: /CreditNote/cbc:ID",
    "sample_value": "",
    "value_set": "",
    "interpretation": "",
    "rules": [],
    "source_pages": [
      3
    ],
    "min_char_length": "",
    "max_char_length": "",
    "min_decimal_precision": "",
    "max_decimal_precision": "",
    "extractor_name": "rs-srbdt-ext-2025"
  },
  {
    "field_id": "BT-10",
    "field_name": "референца купца",
    "field_description": "Buyer reference",
    "note_on_use": "Податак који продавац уноси у фактуру\nпрема инструкцијама које добије од купца,\nа са сврхом да се прецизира усмеравање\nфактуре у оквиру организације купца (нпр.\nознака организационог дела купца). У\nспецијалном случају када се фактура издаје\nпо основу уговора о јавној набавци коју\nније спровео купац (BG-7) тада на почетку\nовог елемента треба да стоји „JN-JBKJS:”\nиза чега следи пет цифара из ЈБКЈС\nнаручиоца који је спровео јавну набавку, а\nнакон тога може да следи цртица и додатни\nкарактери.",
    "data_type": "Text",
    "cardinality": "0..1",
    "invoice_path": "/Invoice/cbc:BuyerReference",
    "credit_note_path": "/CreditNote/cbc:BuyerReference",
    "report_path": "Invoice: /Invoice/cbc:BuyerReference\nCreditNote: /CreditNote/cbc:BuyerReference",
    "sample_value": "",
    "value_set": "",
    "interpretation": "",
    "rules": [],
    "source_pages": [
      4
    ],
    "min_char_length": "",
    "max_char_length": "",
    "min_decimal_precision": "",
    "max_decimal_precision": "",
    "extractor_name": "rs-srbdt-ext-2025"
  },
  {
    "field_id": "BT-100",
    "field_name": "основица за трошак на нивоу документа",
    "field_description": "Document level charge base amount",
    "note_on_use": "Напомена: користити cbc:ChargeIndicator = \"true\"",
    "data_type": "Amount",
    "cardinality": "0..1",
    "invoice_path": "/Invoice/cac:AllowanceCharge/cbc:BaseAmount",
    "credit_note_path": "/CreditNote/cac:AllowanceCharge/cbc:BaseAmount",
    "report_path": "Invoice: /Invoice/cac:AllowanceCharge/cbc:BaseAmount\nCreditNote: /CreditNote/cac:AllowanceCharge/cbc:BaseAmount",
    "sample_value": "",
    "value_set": "",
    "interpretation": "",
    "rules": [],
    "source_pages": [
      15
    ],
    "min_char_length": "",
    "max_char_length": "",
    "min_decimal_precision": "",
    "max_decimal_precision": "",
    "extractor_name": "rs-srbdt-ext-2025"
  },
  {
    "field_id": "BT-101",
    "field_name": "проценат трошка на нивоу документа",
    "field_description": "Document level charge percentage",
    "note_on_use": "Напомена: користити cbc:ChargeIndicator = \"true\"",
    "data_type": "Percent",
    "cardinality": "0..1",
    "invoice_path": "/Invoice/cac:AllowanceCharge/cbc:MultiplierFactorNumeric",
    "credit_note_path": "/CreditNote/cac:AllowanceCharge/cbc:MultiplierFactorNumeric",
    "report_path": "Invoice: /Invoice/cac:AllowanceCharge/cbc:MultiplierFactorNumeric\nCreditNote: /CreditNote/cac:AllowanceCharge/cbc:MultiplierFactorNumeric",
    "sample_value": "",
    "value_set": "",
    "interpretation": "",
    "rules": [],
    "source_pages": [
      15
    ],
    "min_char_length": "",
    "max_char_length": "",
    "min_decimal_precision": "",
    "max_decimal_precision": "",
    "extractor_name": "rs-srbdt-ext-2025"
  },
  {
    "field_id": "BT-102",
    "field_name": "шифра категорије ПДВ-а за трошак на нивоу документа",
    "field_description": "Document level charge VAT category code",
    "note_on_use": "Погледај напомену за BT-118\nНапомена: користити cbc:ChargeIndicator = \"true\"",
    "data_type": "Code",
    "cardinality": "1..1",
    "invoice_path": "/Invoice/cac:AllowanceCharge/cac:TaxCategory/cbc:ID",
    "credit_note_path": "/CreditNote/cac:AllowanceCharge/cac:TaxCategory/cbc:ID",
    "report_path": "Invoice: /Invoice/cac:AllowanceCharge/cac:TaxCategory/cbc:ID\nCreditNote: /CreditNote/cac:AllowanceCharge/cac:TaxCategory/cbc:ID",
    "sample_value": "",
    "value_set": "",
    "interpretation": "",
    "rules": [],
    "source_pages": [
      15
    ],
    "min_char_length": "",
    "max_char_length": "",
    "min_decimal_precision": "",
    "max_decimal_precision": "",
    "extractor_name": "rs-srbdt-ext-2025"
  },
  {
    "field_id": "BT-103",
    "field_name": "стопа ПДВ-а за трошак на нивоу документа",
    "field_description": "Document level charge VAT rate",
    "note_on_use": "Напомена: користити cbc:ChargeIndicator = \"true\"",
    "data_type": "Percent",
    "cardinality": "0..1",
    "invoice_path": "/Invoice/cac:AllowanceCharge/cac:TaxCategory/cbc:Percent",
    "credit_note_path": "/CreditNote/cac:AllowanceCharge/cac:TaxCategory/cbc:Percent",
    "report_path": "Invoice: /Invoice/cac:AllowanceCharge/cac:TaxCategory/cbc:Percent\nCreditNote: /CreditNote/cac:AllowanceCharge/cac:TaxCategory/cbc:Percent",
    "sample_value": "",
    "value_set": "",
    "interpretation": "",
    "rules": [],
    "source_pages": [
      15
    ],
    "min_char_length": "",
    "max_char_length": "",
    "min_decimal_precision": "",
    "max_decimal_precision": "",
    "extractor_name": "rs-srbdt-ext-2025"
  },
  {
    "field_id": "BT-104",
    "field_name": "разлог трошка на нивоу документа",
    "field_description": "Document level charge reason",
    "note_on_use": "Напомена: користити cbc:ChargeIndicator = \"true\"",
    "data_type": "Text",
    "cardinality": "0..1",
    "invoice_path": "/Invoice/cac:AllowanceCharge/cbc:AllowanceChargeReason",
    "credit_note_path": "/CreditNote/cac:AllowanceCharge/cbc:AllowanceChargeReason",
    "report_path": "Invoice: /Invoice/cac:AllowanceCharge/cbc:AllowanceChargeReason\nCreditNote: /CreditNote/cac:AllowanceCharge/cbc:AllowanceChargeReason",
    "sample_value": "",
    "value_set": "",
    "interpretation": "",
    "rules": [],
    "source_pages": [
      15
    ],
    "min_char_length": "",
    "max_char_length": "",
    "min_decimal_precision": "",
    "max_decimal_precision": "",
    "extractor_name": "rs-srbdt-ext-2025"
  },
  {
    "field_id": "BT-105",
    "field_name": "шифра разлога трошка на нивоу документа",
    "field_description": "Document level charge reason code",
    "note_on_use": "Напомена: користити cbc:ChargeIndicator = \"true\"",
    "data_type": "Code",
    "cardinality": "0..1",
    "invoice_path": "/Invoice/cac:AllowanceCharge/cbc:AllowanceChargeReasonCode",
    "credit_note_path": "/CreditNote/cac:AllowanceCharge/cbc:AllowanceChargeReasonCode",
    "report_path": "Invoice: /Invoice/cac:AllowanceCharge/cbc:AllowanceChargeReasonCode\nCreditNote: /CreditNote/cac:AllowanceCharge/cbc:AllowanceChargeReasonCode",
    "sample_value": "",
    "value_set": "",
    "interpretation": "",
    "rules": [],
    "source_pages": [
      15
    ],
    "min_char_length": "",
    "max_char_length": "",
    "min_decimal_precision": "",
    "max_decimal_precision": "",
    "extractor_name": "rs-srbdt-ext-2025"
  },
  {
    "field_id": "BT-106",
    "field_name": "збир нето износа из ставки рачуна",
    "field_description": "Sum of Invoice line net amount",
    "note_on_use": "",
    "data_type": "Amount",
    "cardinality": "1..1",
    "invoice_path": "/Invoice/cac:LegalMonetaryTotal/cbc:LineExtensionAmount",
    "credit_note_path": "/CreditNote/cac:LegalMonetaryTotal/cbc:LineExtensionAmount",
    "report_path": "Invoice: /Invoice/cac:LegalMonetaryTotal/cbc:LineExtensionAmount\nCreditNote: /CreditNote/cac:LegalMonetaryTotal/cbc:LineExtensionAmount",
    "sample_value": "",
    "value_set": "",
    "interpretation": "",
    "rules": [],
    "source_pages": [
      15
    ],
    "min_char_length": "",
    "max_char_length": "",
    "min_decimal_precision": "",
    "max_decimal_precision": "",
    "extractor_name": "rs-srbdt-ext-2025"
  },
  {
    "field_id": "BT-107",
    "field_name": "збир попуста на нивоу документа",
    "field_description": "Sum of allowances on document level",
    "note_on_use": "",
    "data_type": "Amount",
    "cardinality": "0..1",
    "invoice_path": "/Invoice/cac:LegalMonetaryTotal/cbc:AllowanceTotalAmount",
    "credit_note_path": "/CreditNote/cac:LegalMonetaryTotal/cbc:AllowanceTotalAmount",
    "report_path": "Invoice: /Invoice/cac:LegalMonetaryTotal/cbc:AllowanceTotalAmount\nCreditNote: /CreditNote/cac:LegalMonetaryTotal/cbc:AllowanceTotalAmount",
    "sample_value": "",
    "value_set": "",
    "interpretation": "",
    "rules": [],
    "source_pages": [
      15
    ],
    "min_char_length": "",
    "max_char_length": "",
    "min_decimal_precision": "",
    "max_decimal_precision": "",
    "extractor_name": "rs-srbdt-ext-2025"
  },
  {
    "field_id": "BT-108",
    "field_name": "збир трошкова на нивоу документа",
    "field_description": "Sum of charges on document level",
    "note_on_use": "",
    "data_type": "Amount",
    "cardinality": "0..1",
    "invoice_path": "/Invoice/cac:LegalMonetaryTotal/cbc:ChargeTotalAmount",
    "credit_note_path": "/CreditNote/cac:LegalMonetaryTotal/cbc:ChargeTotalAmount",
    "report_path": "Invoice: /Invoice/cac:LegalMonetaryTotal/cbc:ChargeTotalAmount\nCreditNote: /CreditNote/cac:LegalMonetaryTotal/cbc:ChargeTotalAmount",
    "sample_value": "",
    "value_set": "",
    "interpretation": "",
    "rules": [],
    "source_pages": [
      15
    ],
    "min_char_length": "",
    "max_char_length": "",
    "min_decimal_precision": "",
    "max_decimal_precision": "",
    "extractor_name": "rs-srbdt-ext-2025"
  },
  {
    "field_id": "BT-109",
    "field_name": "укупан износ без ПДВ-а",
    "field_description": "Invoice total amount without VAT",